A1: STATE | B1: Number of McDonald's | C1: Number of Payday Lenders | D1: How many more Payday Lenders? | E1: RANK | F1: Payday Lenders Per 100,000 | G1: McDonald's per 100,000 | H1: Difference | I1: Rank
A2: Alabama | B2: 210 | C2: 1177 | D2: 967 | E2: 4 | F2: 26.47 | G2: 4.72 | H2: -21.75 | I2: =RANK(H2,$H$2:$H$51,1) -> 4
A3: Alaska | B3: 27 | C3: 22 | D3: -5 | E3: 33 | F3: 3.51 | G3: 4.31 | H3: 0.80 | I3: =RANK(H3,$H$2:$H$51,1) -> 34
A4: Arizona | B4: 212 | C4: 726 | D4: 514 | E4: 11 | F4: 14.15 | G4: 4.13 | H4: -10.02 | I4: =RANK(H4,$H$2:$H$51,1) -> 13
A5: Arkansas | B5: 127 | C5: 275 | D5: 148 | E5: 23 | F5: 10.29 | G5: 4.75 | H5: -5.54 | I5: =RANK(H5,$H$2:$H$51,1) -> 24
A6: California | B6: 1165 | C6: 2451 | D6: 1286 | E6: 1 | F6: 7.24 | G6: 3.44 | H6: -3.80 | I6: =RANK(H6,$H$2:$H$51,1) -> 27
A7: Colorado | B7: 181 | C7: 577 | D7: 396 | E7: 15 | F7: 13.41 | G7: 4.21 | H7: -9.20 | I7: =RANK(H7,$H$2:$H$51,1) -> 15
A8: Connecticut | B8: 143 | C8: 0 | D8: -143 | E8: 42 | F8: 0.00 | G8: 4.20 | H8: 4.20 | I8: =RANK(H8,$H$2:$H$51,1) -> 45
A9: Delaware | B9: 34 | C9: 82 | D9: 48 | E9: 31 | F9: 10.46 | G9: 4.34 | H9: -6.12 | I9: =RANK(H9,$H$2:$H$51,1) -> 23
A10: Florida | B10: 728 | C10: 1164 | D10: 436 | E10: 14 | F10: 7.28 | G10: 4.56 | H10: -2.72 | I10: =RANK(H10,$H$2:$H$51,1) -> 29
A11: Georgia | B11: 365 | C11: 0 | D11: -365 | E11: 48 | F11: 0.00 | G11: 4.46 | H11: 4.46 | I11: =RANK(H11,$H$2:$H$51,1) -> 46
A12: Hawaii | B12: 76 | C12: 26 | D12: -50 | E12: 38 | F12: 2.15 | G12: 6.27 | H12: 4.12 | I12: =RANK(H12,$H$2:$H$51,1) -> 44
A13: Idaho | B13: 50 | C13: 196 | D13: 146 | E13: 24 | F13: 15.15 | G13: 3.86 | H13: -11.29 | I13: =RANK(H13,$H$2:$H$51,1) -> 11
A14: Illinois | B14: 647 | C14: 727 | D14: 80 | E14: 27 | F14: 5.85 | G14: 5.21 | H14: -0.64 | I14: =RANK(H14,$H$2:$H$51,1) -> 32
A15: Indiana | B15: 326 | C15: 117 | D15: -209 | E15: 44 | F15: 1.92 | G15: 5.36 | H15: 3.44 | I15: =RANK(H15,$H$2:$H$51,1) -> 40
A16: Iowa (corrupt data?) | B16: 131 | C16: 412 | D16: 281 | E16: 19 | F16: 14.08 | G16: 4.48 | H16: -9.60 | I16: =RANK(H16,$H$2:$H$51,1) -> 14
A17: Kansas | B17: 147 | C17: 100 | D17: -47 | E17: 37 | F17: 3.72 | G17: 5.47 | H17: 1.75 | I17: =RANK(H17,$H$2:$H$51,1) -> 36
A18: Kentucky | B18: 221 | C18: 707 | D18: 486 | E18: 12 | F18: 17.49 | G18: 5.47 | H18: -12.02 | I18: =RANK(H18,$H$2:$H$51,1) -> 10
A19: Louisiana | B19: 226 | C19: 1009 | D19: 783 | E19: 7 | F19: 22.58 | G19: 5.06 | H19: -17.52 | I19: =RANK(H19,$H$2:$H$51,1) -> 7
A20: Maine | B20: 58 | C20: 6 | D20: -52 | E20: 39 | F20: 0.47 | G20: 4.55 | H20: 4.08 | I20: =RANK(H20,$H$2:$H$51,1) -> 43
A21: Maryland | B21: 280 | C21: 0 | D21: -280 | E21: 47 | F21: 0.00 | G21: 5.29 | H21: 5.29 | I21: =RANK(H21,$H$2:$H$51,1) -> 50
A22: Massachusetts | B22: 249 | C22: 0 | D22: -249 | E22: 45 | F22: 0.00 | G22: 3.92 | H22: 3.92 | I22: =RANK(H22,$H$2:$H$51,1) -> 42
A23: Michigan | B23: 545 | C23: 650 | D23: 105 | E23: 26 | F23: 6.54 | G23: 5.48 | H23: -1.06 | I23: =RANK(H23,$H$2:$H$51,1) -> 31
A24: Minnesota | B24: 203 | C24: 55 | D24: -148 | E24: 43 | F24: 1.12 | G24: 4.13 | H24: 3.01 | I24: =RANK(H24,$H$2:$H$51,1) -> 38
A25: Mississippi | B25: 124 | C25: 1100 | D25: 976 | E25: 3 | F25: 38.67 | G25: 4.36 | H25: -34.31 | I25: =RANK(H25,$H$2:$H$51,1) -> 3
A26: Missouri | B26: 299 | C26: 1257 | D26: 958 | E26: 5 | F26: 22.47 | G26: 5.34 | H26: -17.13 | I26: =RANK(H26,$H$2:$H$51,1) -> 8
A27: Montana | B27: 41 | C27: 104 | D27: 63 | E27: 28 | F27: 11.53 | G27: 4.54 | H27: -6.99 | I27: =RANK(H27,$H$2:$H$51,1) -> 20
A28: Nebraska | B28: 71 | C28: 57 | D28: -14 | E28: 34 | F28: 3.33 | G28: 4.15 | H28: 0.82 | I28: =RANK(H28,$H$2:$H$51,1) -> 35
A29: Nevada | B29: 128 | C29: 256 | D29: 128 | E29: 25 | F29: 12.81 | G29: 6.41 | H29: -6.40 | I29: =RANK(H29,$H$2:$H$51,1) -> 22
A30: New Hampshire | B30: 62 | C30: 77 | D30: 15 | E30: 32 | F30: 6.23 | G30: 5.02 | H30: -1.21 | I30: =RANK(H30,$H$2:$H$51,1) -> 30
A31: New Jersey | B31: 261 | C31: 0 | D31: -261 | E31: 46 | F31: 0.00 | G31: 3.10 | H31: 3.10 | I31: =RANK(H31,$H$2:$H$51,1) -> 39
A32: New Mexico | B32: 80 | C32: 760 | D32: 680 | E32: 10 | F32: 41.78 | G32: 4.40 | H32: -37.38 | I32: =RANK(H32,$H$2:$H$51,1) -> 1
A33: New York | B33: 655 | C33: 0 | D33: -655 | E33: 50 | F33: 0.00 | G33: 3.45 | H33: 3.45 | I33: =RANK(H33,$H$2:$H$51,1) -> 41
A34: North Carolina | B34: 374 | C34: 0 | D34: -374 | E34: 49 | F34: 0.00 | G34: 4.65 | H34: 4.65 | I34: =RANK(H34,$H$2:$H$51,1) -> 47
A35: North Dakota | B35: 22 | C35: 76 | D35: 54 | E35: 29 | F35: 11.83 | G35: 3.43 | H35: -8.40 | I35: =RANK(H35,$H$2:$H$51,1) -> 17
A36: Ohio | B36: 616 | C36: 1374 | D36: 758 | E36: 8 | F36: 12.10 | G36: 5.43 | H36: -6.67 | I36: =RANK(H36,$H$2:$H$51,1) -> 21
A37: Oklahoma | B37: 155 | C37: 397 | D37: 242 | E37: 21 | F37: 11.51 | G37: 4.49 | H37: -7.02 | I37: =RANK(H37,$H$2:$H$51,1) -> 19
A38: Oregon | B38: 152 | C38: 453 | D38: 301 | E38: 18 | F38: 13.24 | G38: 4.44 | H38: -8.80 | I38: =RANK(H38,$H$2:$H$51,1) -> 16
A39: Pennsylvania | B39: 497 | C39: 400 | D39: -97 | E39: 41 | F39: 3.26 | G39: 4.05 | H39: 0.79 | I39: =RANK(H39,$H$2:$H$51,1) -> 33
A40: Rhode Island | B40: 35 | C40: 5 | D40: -30 | E40: 36 | F40: 0.48 | G40: 3.34 | H40: 2.86 | I40: =RANK(H40,$H$2:$H$51,1) -> 37
A41: South Carolina | B41: 180 | C41: 902 | D41: 722 | E41: 9 | F41: 22.48 | G41: 4.49 | H41: -17.99 | I41: =RANK(H41,$H$2:$H$51,1) -> 6
A42: South Dakota | B42: 29 | C42: 302 | D42: 273 | E42: 20 | F42: 40.01 | G42: 3.84 | H42: -36.17 | I42: =RANK(H42,$H$2:$H$51,1) -> 2
A43: Tennessee | B43: 285 | C43: 1344 | D43: 1059 | E43: 2 | F43: 23.62 | G43: 5.01 | H43: -18.61 | I43: =RANK(H43,$H$2:$H$51,1) -> 5
A44: Texas | B44: 834 | C44: 1675 | D44: 841 | E44: 6 | F44: 8.03 | G44: 4.00 | H44: -4.03 | I44: =RANK(H44,$H$2:$H$51,1) -> 26
A45: Utah | B45: 89 | C45: 427 | D45: 338 | E45: 17 | F45: 19.12 | G45: 3.99 | H45: -15.13 | I45: =RANK(H45,$H$2:$H$51,1) -> 9
A46: Vermont | B46: 29 | C46: 0 | D46: -29 | E46: 35 | F46: 0.00 | G46: 4.76 | H46: 4.76 | I46: =RANK(H46,$H$2:$H$51,1) -> 48
A47: Virginia | B47: 382 | C47: 743 | D47: 361 | E47: 16 | F47: 10.50 | G47: 5.40 | H47: -5.10 | I47: =RANK(H47,$H$2:$H$51,1) -> 25
A48: Washington | B48: 251 | C48: 713 | D48: 462 | E48: 13 | F48: 12.10 | G48: 4.26 | H48: -7.84 | I48: =RANK(H48,$H$2:$H$51,1) -> 18
A49: West Virginia | B49: 90 | C49: 0 | D49: -90 | E49: 40 | F49: 0.00 | G49: 4.98 | H49: 4.98 | I49: =RANK(H49,$H$2:$H$51,1) -> 49
A50: Wisconsin | B50: 285 | C50: 439 | D50: 154 | E50: 22 | F50: 8.18 | G50: 5.31 | H50: -2.87 | I50: =RANK(H50,$H$2:$H$51,1) -> 28
A51: Wyoming | B51: 24 | C51: 77 | D51: 53 | E51: 30 | F51: 15.59 | G51: 4.86 | H51: -10.73 | I51: =RANK(H51,$H$2:$H$51,1) -> 12
A53: Total | B53: =SUM(B2:B51) -> 12401 | C53: =SUM(C2:C51) -> 23417 | D53: =SUM(D2:D51) -> 11016 | E53: -- | F53: -- | G53: -- | H53: -- | I53: --
A54: Average | B54: =AVERAGE(B2:B51) -> 248.02 | C54: =AVERAGE(C2:C51) -> 468.34 | D54: =AVERAGE(D2:D51) -> 220.32 | E54: -- | F54: =AVERAGE(F2:F51) -> 10.654999999999999 | G54: =AVERAGE(G2:G51) -> 4.583400000000001 | H54: =AVERAGE(H2:H51) -> -6.071600000000001 | I54: --